statement ok
create table t(id int primary key, v1 int, v2 int, v3 int default 233)

statement ok
insert into t values (0,1,10,100)

statement ok
insert into t values (1,1,10,100), (2,2,20,200), (3,3,30,300), (4,4,40,400)

statement ok
update t set v2 = 9 where v1 = 1

query IIII rowsort
select * from t;
----
0 1 9 100
1 1 9 100
2 2 20 200
3 3 30 300
4 4 40 400

statement ok
update t set v2 = 9

query IIII rowsort
select * from t
----
0 1 9 100
1 1 9 100
2 2 9 200
3 3 9 300
4 4 9 400

statement ok
update t set v3 = default

query IIII rowsort
select * from t
----
0 1 9 233
1 1 9 233
2 2 9 233
3 3 9 233
4 4 9 233

statement ok
update t set v3 = v1 + 1

query IIII rowsort
select * from t
----
0 1 9 2
1 1 9 2
2 2 9 3
3 3 9 4
4 4 9 5

statement ok
update t set (v2, v3) = (v1 + 10, v3 + 20) where id = 2

query IIII
select * from t where id = 2
----
2 2 12 23

statement ok
drop table t

statement ok
create table t_update_idx(id int primary key, b int, c int)

statement ok
copy t_update_idx from 'tests/data/row_20000.csv' ( DELIMITER '|' )

statement ok
create index idx_t_update_idx_b on t_update_idx(b)

statement ok
analyze table t_update_idx

query T
explain select id, b, c from t_update_idx where b = 10
----
Projection [#1, #2, #3] [Project => (Sort Option: Follow)] TableScan t_update_idx -> [#1, #2, #3] [IndexScan By #2 => 10 => (Sort Option: OrderBy: (#2 Asc Nulls Last) ignore_prefix_len: 0)]

statement ok
update t_update_idx set c = 111 where id = 9

query III
select id, b, c from t_update_idx where b = 10
----
9 10 111

statement ok
update t_update_idx set id = 300000 where id = 9

query III
select id, b, c from t_update_idx where b = 10
----
300000 10 111

statement ok
drop table t_update_idx
