statement ok
create table t1(id int primary key, c1 int, c2 int);

statement ok
copy t1 from 'tests/data/row_20000.csv' ( DELIMITER '|' );

statement ok
insert into t1 values(100000000, null, null);

statement ok
create unique index u_c1_index on t1 (c1);

statement ok
create index c2_index on t1 (c2);

statement ok
create index p_index on t1 (c1, c2);

statement ok
analyze table t1;

query T
explain select * from t1 limit 10;
----
Projection [t1.id, t1.c1, t1.c2] [Project => (Sort Option: Follow)] TableScan t1 -> [id, c1, c2], Limit: 10 [SeqScan => (Sort Option: None)]

query T
explain select * from t1 where id = 0;
----
Projection [t1.id, t1.c1, t1.c2] [Project => (Sort Option: Follow)] Filter (t1.id = 0), Is Having: false [Filter => (Sort Option: Follow)] TableScan t1 -> [id, c1, c2] [IndexScan By pk_index => 0 => (Sort Option: OrderBy: (t1.id Asc Nulls Last) ignore_prefix_len: 0)]

query T
explain select * from t1 where id = 0 and id = 1;
----
Projection [t1.id, t1.c1, t1.c2] [Project => (Sort Option: Follow)] Filter ((t1.id = 0) && (t1.id = 1)), Is Having: false [Filter => (Sort Option: Follow)] TableScan t1 -> [id, c1, c2] [IndexScan By pk_index => Dummy => (Sort Option: OrderBy: (t1.id Asc Nulls Last) ignore_prefix_len: 0)]

query T
explain select * from t1 where id = 0 and id != 0;
----
Projection [t1.id, t1.c1, t1.c2] [Project => (Sort Option: Follow)] Filter ((t1.id = 0) && (t1.id != 0)), Is Having: false [Filter => (Sort Option: Follow)] TableScan t1 -> [id, c1, c2] [IndexScan By pk_index => 0 => (Sort Option: OrderBy: (t1.id Asc Nulls Last) ignore_prefix_len: 0)]

query T
explain select * from t1 where id = 0 or id != 0 limit 10;
----
Projection [t1.id, t1.c1, t1.c2] [Project => (Sort Option: Follow)] Limit 10 [Limit => (Sort Option: Follow)] Filter ((t1.id = 0) || (t1.id != 0)), Is Having: false [Filter => (Sort Option: Follow)] TableScan t1 -> [id, c1, c2] [SeqScan => (Sort Option: None)]

query T
explain select * from t1 where id = 0 and id != 0 and id = 3;
----
Projection [t1.id, t1.c1, t1.c2] [Project => (Sort Option: Follow)] Filter (((t1.id = 0) && (t1.id != 0)) && (t1.id = 3)), Is Having: false [Filter => (Sort Option: Follow)] TableScan t1 -> [id, c1, c2] [IndexScan By pk_index => Dummy => (Sort Option: OrderBy: (t1.id Asc Nulls Last) ignore_prefix_len: 0)]

query T
explain select * from t1 where id = 0 and id != 0 or id = 3;
----
Projection [t1.id, t1.c1, t1.c2] [Project => (Sort Option: Follow)] Filter (((t1.id = 0) && (t1.id != 0)) || (t1.id = 3)), Is Having: false [Filter => (Sort Option: Follow)] TableScan t1 -> [id, c1, c2] [IndexScan By pk_index => 0, 3 => (Sort Option: OrderBy: (t1.id Asc Nulls Last) ignore_prefix_len: 0)]

query T
explain select * from t1 where id > 0 and id = 3;
----
Projection [t1.id, t1.c1, t1.c2] [Project => (Sort Option: Follow)] Filter ((t1.id > 0) && (t1.id = 3)), Is Having: false [Filter => (Sort Option: Follow)] TableScan t1 -> [id, c1, c2] [IndexScan By pk_index => 3 => (Sort Option: OrderBy: (t1.id Asc Nulls Last) ignore_prefix_len: 0)]

query T
explain select * from t1 where id >= 0 and id <= 3;
----
Projection [t1.id, t1.c1, t1.c2] [Project => (Sort Option: Follow)] Filter ((t1.id >= 0) && (t1.id <= 3)), Is Having: false [Filter => (Sort Option: Follow)] TableScan t1 -> [id, c1, c2] [IndexScan By pk_index => [0, 3] => (Sort Option: OrderBy: (t1.id Asc Nulls Last) ignore_prefix_len: 0)]

query T
explain select * from t1 where id <= 0 and id >= 3;
----
Projection [t1.id, t1.c1, t1.c2] [Project => (Sort Option: Follow)] Filter ((t1.id <= 0) && (t1.id >= 3)), Is Having: false [Filter => (Sort Option: Follow)] TableScan t1 -> [id, c1, c2] [IndexScan By pk_index => Dummy => (Sort Option: OrderBy: (t1.id Asc Nulls Last) ignore_prefix_len: 0)]

query T
explain select * from t1 where id >= 3 or id <= 9 limit 10;
----
Projection [t1.id, t1.c1, t1.c2] [Project => (Sort Option: Follow)] Limit 10 [Limit => (Sort Option: Follow)] Filter ((t1.id >= 3) || (t1.id <= 9)), Is Having: false [Filter => (Sort Option: Follow)] TableScan t1 -> [id, c1, c2] [SeqScan => (Sort Option: None)]

query T
explain select * from t1 where id <= 3 or id >= 9 limit 10;
----
Projection [t1.id, t1.c1, t1.c2] [Project => (Sort Option: Follow)] Limit 10 [Limit => (Sort Option: Follow)] Filter ((t1.id <= 3) || (t1.id >= 9)), Is Having: false [Filter => (Sort Option: Follow)] TableScan t1 -> [id, c1, c2] [IndexScan By pk_index => (-inf, 3], [9, +inf) => (Sort Option: OrderBy: (t1.id Asc Nulls Last) ignore_prefix_len: 0)]

query T
explain select * from t1 where (id >= 0 and id <= 3) or (id >= 9 and id <= 12);
----
Projection [t1.id, t1.c1, t1.c2] [Project => (Sort Option: Follow)] Filter (((t1.id >= 0) && (t1.id <= 3)) || ((t1.id >= 9) && (t1.id <= 12))), Is Having: false [Filter => (Sort Option: Follow)] TableScan t1 -> [id, c1, c2] [IndexScan By pk_index => [0, 3], [9, 12] => (Sort Option: OrderBy: (t1.id Asc Nulls Last) ignore_prefix_len: 0)]

query T
explain select * from t1 where (id >= 0 or id <= 3) and (id >= 9 or id <= 12) limit 10;
----
Projection [t1.id, t1.c1, t1.c2] [Project => (Sort Option: Follow)] Limit 10 [Limit => (Sort Option: Follow)] Filter (((t1.id >= 0) || (t1.id <= 3)) && ((t1.id >= 9) || (t1.id <= 12))), Is Having: false [Filter => (Sort Option: Follow)] TableScan t1 -> [id, c1, c2] [SeqScan => (Sort Option: None)]

query T
explain select * from t1 where id = 5 or (id > 5 and (id > 6 or id < 8) and id < 12);
----
Projection [t1.id, t1.c1, t1.c2] [Project => (Sort Option: Follow)] Filter ((t1.id = 5) || (((t1.id > 5) && ((t1.id > 6) || (t1.id < 8))) && (t1.id < 12))), Is Having: false [Filter => (Sort Option: Follow)] TableScan t1 -> [id, c1, c2] [IndexScan By pk_index => [5, 12) => (Sort Option: OrderBy: (t1.id Asc Nulls Last) ignore_prefix_len: 0)]

query T
explain select * from t1 where c1 = 7 and c2 = 8;
----
Projection [t1.id, t1.c1, t1.c2] [Project => (Sort Option: Follow)] Filter ((t1.c1 = 7) && (t1.c2 = 8)), Is Having: false [Filter => (Sort Option: Follow)] TableScan t1 -> [id, c1, c2] [IndexScan By u_c1_index => 7 => (Sort Option: OrderBy: (t1.c1 Asc Nulls Last) ignore_prefix_len: 0)]

query T
explain select * from t1 where c1 = 7 and c2 < 9;
----
Projection [t1.id, t1.c1, t1.c2] [Project => (Sort Option: Follow)] Filter ((t1.c1 = 7) && (t1.c2 < 9)), Is Having: false [Filter => (Sort Option: Follow)] TableScan t1 -> [id, c1, c2] [IndexScan By u_c1_index => 7 => (Sort Option: OrderBy: (t1.c1 Asc Nulls Last) ignore_prefix_len: 0)]

query T
explain select * from t1 where (c1 = 7 or c1 = 10) and c2 < 9;
----
Projection [t1.id, t1.c1, t1.c2] [Project => (Sort Option: Follow)] Filter (((t1.c1 = 7) || (t1.c1 = 10)) && (t1.c2 < 9)), Is Having: false [Filter => (Sort Option: Follow)] TableScan t1 -> [id, c1, c2] [IndexScan By u_c1_index => 7, 10 => (Sort Option: OrderBy: (t1.c1 Asc Nulls Last) ignore_prefix_len: 0)]

query T
explain select * from t1 where c1 is null and c2 is null;
----
Projection [t1.id, t1.c1, t1.c2] [Project => (Sort Option: Follow)] Filter (t1.c1 is null && t1.c2 is null), Is Having: false [Filter => (Sort Option: Follow)] TableScan t1 -> [id, c1, c2] [IndexScan By c2_index => null => (Sort Option: OrderBy: (t1.c2 Asc Nulls Last) ignore_prefix_len: 0)]

query T
explain select * from t1 where c1 > 0 and c1 < 8;
----
Projection [t1.id, t1.c1, t1.c2] [Project => (Sort Option: Follow)] Filter ((t1.c1 > 0) && (t1.c1 < 8)), Is Having: false [Filter => (Sort Option: Follow)] TableScan t1 -> [id, c1, c2] [IndexScan By u_c1_index => (0, 8) => (Sort Option: OrderBy: (t1.c1 Asc Nulls Last) ignore_prefix_len: 0)]

query T
explain select * from t1 where c2 > 0 and c2 < 9;
----
Projection [t1.id, t1.c1, t1.c2] [Project => (Sort Option: Follow)] Filter ((t1.c2 > 0) && (t1.c2 < 9)), Is Having: false [Filter => (Sort Option: Follow)] TableScan t1 -> [id, c1, c2] [IndexScan By c2_index => (0, 9) => (Sort Option: OrderBy: (t1.c2 Asc Nulls Last) ignore_prefix_len: 0)]

query T
explain select * from t1 where c2 = 5;
----
Projection [t1.id, t1.c1, t1.c2] [Project => (Sort Option: Follow)] Filter (t1.c2 = 5), Is Having: false [Filter => (Sort Option: Follow)] TableScan t1 -> [id, c1, c2] [IndexScan By c2_index => 5 => (Sort Option: OrderBy: (t1.c2 Asc Nulls Last) ignore_prefix_len: 0)]

statement ok
update t1 set c2 = 9 where c1 = 1

query T
explain select * from t1 where c2 > 0 and c2 < 10;
----
Projection [t1.id, t1.c1, t1.c2] [Project => (Sort Option: Follow)] Filter ((t1.c2 > 0) && (t1.c2 < 10)), Is Having: false [Filter => (Sort Option: Follow)] TableScan t1 -> [id, c1, c2] [IndexScan By c2_index => (0, 10) => (Sort Option: OrderBy: (t1.c2 Asc Nulls Last) ignore_prefix_len: 0)]

statement ok
delete from t1 where c1 = 4

query T
explain select * from t1 where c2 > 0 and c2 < 10;
----
Projection [t1.id, t1.c1, t1.c2] [Project => (Sort Option: Follow)] Filter ((t1.c2 > 0) && (t1.c2 < 10)), Is Having: false [Filter => (Sort Option: Follow)] TableScan t1 -> [id, c1, c2] [IndexScan By c2_index => (0, 10) => (Sort Option: OrderBy: (t1.c2 Asc Nulls Last) ignore_prefix_len: 0)]


# unique covered
query T
explain select c1 from t1 where c1 < 10;
----
Projection [t1.c1] [Project => (Sort Option: Follow)] Filter (t1.c1 < 10), Is Having: false [Filter => (Sort Option: Follow)] TableScan t1 -> [c1] [IndexScan By p_index => (-inf, (10)) Covered => (Sort Option: OrderBy: (t1.c1 Asc Nulls Last, t1.c2 Asc Nulls Last) ignore_prefix_len: 0)]

# unique covered with primary key projection
query T
explain select c1, id from t1 where c1 < 10;
----
Projection [t1.c1, t1.id] [Project => (Sort Option: Follow)] Filter (t1.c1 < 10), Is Having: false [Filter => (Sort Option: Follow)] TableScan t1 -> [id, c1] [IndexScan By p_index => (-inf, (10)) => (Sort Option: OrderBy: (t1.c1 Asc Nulls Last, t1.c2 Asc Nulls Last) ignore_prefix_len: 0)]

statement ok
drop index t1.u_c1_index;

# normal covered
query T
explain select c2 from t1 where c2 < 10 and c2 > 0;
----
Projection [t1.c2] [Project => (Sort Option: Follow)] Filter ((t1.c2 < 10) && (t1.c2 > 0)), Is Having: false [Filter => (Sort Option: Follow)] TableScan t1 -> [c2] [IndexScan By c2_index => (0, 10) Covered => (Sort Option: OrderBy: (t1.c2 Asc Nulls Last) ignore_prefix_len: 0)]

statement ok
insert into t1 values(100000002, 100000002, 8);

# stream distinct
query T
explain select distinct c2 from t1 where c2 < 10 and c2 > 0;
----
Projection [t1.c2] [Project => (Sort Option: Follow)] Aggregate [] -> Group By [t1.c2] [StreamDistinct => (Sort Option: Follow)] Filter ((t1.c2 < 10) && (t1.c2 > 0)), Is Having: false [Filter => (Sort Option: Follow)] TableScan t1 -> [c2] [IndexScan By c2_index => (0, 10) Covered => (Sort Option: OrderBy: (t1.c2 Asc Nulls Last) ignore_prefix_len: 0)]

statement ok
delete from t1 where id = 100000002;

statement ok
drop index t1.c2_index;

# composite covered
query T
explain select c1, c2 from t1 where c1 < 10 and c1 > 0 and c2 >0 and c2 < 10;
----
Projection [t1.c1, t1.c2] [Project => (Sort Option: Follow)] Filter ((((t1.c1 < 10) && (t1.c1 > 0)) && (t1.c2 > 0)) && (t1.c2 < 10)), Is Having: false [Filter => (Sort Option: Follow)] TableScan t1 -> [c1, c2] [IndexScan By p_index => ((0), (10)) Covered => (Sort Option: OrderBy: (t1.c1 Asc Nulls Last, t1.c2 Asc Nulls Last) ignore_prefix_len: 0)]

# composite covered projection reorder
query T
explain select c2, c1 from t1 where c1 < 10 and c1 > 0 and c2 > 0 and c2 < 10;
----
Projection [t1.c2, t1.c1] [Project => (Sort Option: Follow)] Filter ((((t1.c1 < 10) && (t1.c1 > 0)) && (t1.c2 > 0)) && (t1.c2 < 10)), Is Having: false [Filter => (Sort Option: Follow)] TableScan t1 -> [c1, c2] [IndexScan By p_index => ((0), (10)) Covered => (Sort Option: OrderBy: (t1.c1 Asc Nulls Last, t1.c2 Asc Nulls Last) ignore_prefix_len: 0)]


statement ok
drop table t1;

statement ok
create table t_cover(id int primary key, c1 int, c2 int, c3 int);

statement ok
insert into t_cover values
    (1, 1, 10, 11),
    (2, 2, 20, 21),
    (3, 2, 22, 23),
    (4, 3, 30, 31);

statement ok
create index idx_cover on t_cover (c1, c2, c3);

# composite index trailing columns cover (index columns > output columns)
query T
explain select c2, c3 from t_cover where c1 = 2;
----
Projection [t_cover.c2, t_cover.c3] [Project => (Sort Option: Follow)] Filter (t_cover.c1 = 2), Is Having: false [Filter => (Sort Option: Follow)] TableScan t_cover -> [c1, c2, c3] [SeqScan => (Sort Option: None)]

statement ok
drop table t_cover;
